"","WBID","Category","Category Certainty","Business Sector","Activity","Activity Certainty"
"1","GB106039030380","Local and Central Government","Confirmed","Not applicable","Other (not in list, must add details in comments)","Confirmed"
"2","GB106039030380","Urban and transport","Confirmed","Not applicable","Other (not in list, must add details in comments)","Confirmed"
"3","GB106039030380","Industry","Probable","Other industry, manufacturing and Business","Trade/Industry discharge","Probable"
"4","GB106039030380","Urban and transport","Probable","Other (not in list)","Urbanisation - urban development","Probable"
"5","GB106039030380","Industry","Probable","Other industry, manufacturing and Business","Trade/Industry discharge","Probable"
"6","GB106039030380","No sector responsible","Not applicable","Not applicable","North american signal crayfish","Suspected"
"7","GB106039030380","Industry","Probable","Other industry, manufacturing and Business","Trade/Industry discharge","Probable"
"8","GB106039030380","Navigation","Suspected","Inland Waterways","Groundwater abstraction","Suspected"
