"","X","text","n"
"1",1,"high maynard reservoir",11
"2",2,"new high maynard reservoir lake safety book",2
"3",3,"a burnet companion",1
"4",4,"christmas goslings    high maynard reservoir",1
"5",5,"cloudy          high maynard reservoir",1
"6",6,"con la lesli",1
"7",7,"golden eye high maynard",1
"8",8,"hale and high maynard reservoir",1
"9",9,"high maynard reservoir london",1
"10",10,"high maynard reservoir priestley way",1
"11",11,"painted lady high maynard reservoir  walthamstow",1
"12",12,"pochard and tufted duck",1
"13",13,"round high maynard reservoir",1
"14",14,"such a green space",1
"15",15,"the eastern bank",1
"16",16,"the essential lake safety guide",1
"17",17,"the new loft room",1
"18",18,"the same changes",1
"19",19,"the summer months",1
"20",20,"walthamstow high maynard reservoir",1
"21",21,"wonderful cold winter light",1
"22",22,"your high maynard reservoir",1
